r_pytania,kategoria,pytanie,odpowiada,zgaduje,dodatkowo,Dawid,Wiktoria,Patrycja
1,Śmieszne,"Czy Twoje rozmowy w windzie trwają wieki, mimo że jadą dwa piętra?",Dawid,Patrycja,Wiktoria,1,1,0
2,Śmieszne,"Czy potrafisz przez przypadek zablokować telefon twarzą, próbując odebrać?",Wiktoria,Patrycja,Dawid,0,1,2
3,Śmieszne,Czy Twoja reakcja na niespodziankę to zwykle szok i zamieszanie?,Patrycja,Wiktoria,Dawid,1,3,2
4,Przeszłość,Czy lubiłeś brać udział w szkolnych przedstawieniach lub konkursach?,Dawid,Wiktoria,Patrycja,2,2,1
5,Przeszłość,Jak często jako dziecko sięgałeś po słodycze?,Wiktoria,Dawid,Patrycja,3,2,1
6,Przeszłość,Na ile byłeś zadowolony z relacji z kolegami lub koleżankami?,Patrycja,Dawid,Wiktoria,2,1,2
