r_pytania,kategoria,pytanie,odpowiada,zgaduje,dodatkowo,Dawid,Wiktoria,Patrycja
1,Pikantne,Czy lubisz budować napięcie zanim dojdzie do zbliżenia?,Dawid,Patrycja,Wiktoria,2,1,2
2,Pikantne,Czy jesteś bardziej dominujący niż uległy?,Wiktoria,Patrycja,Dawid,1,2,2
3,Pikantne,Czy lubisz być zaskakiwany w sypialni?,Patrycja,Wiktoria,Dawid,0,2,1
4,Pikantne,Czy bliskość fizyczna buduje dla Ciebie emocjonalną więź?,Dawid,Wiktoria,Patrycja,2,3,1
5,Pikantne,Czy jesteś osobą bardziej zmysłową niż impulsywną?,Wiktoria,Dawid,Patrycja,3,2,1
6,Pikantne,Czy zdarza Ci się fantazjować w najmniej odpowiednim momencie?,Patrycja,Dawid,Wiktoria,3,1,2
