id;text;category;left;right
luz010;Czy masz nawyk tworzenia playlist na każdą możliwą okazję?;Luźne;NIE;TAK
imp020;Wolisz piwo z puszki czy z butelki?;Imprezowe;Z PUSZKI;Z BUTELKI
pre019;Czy dobrze wspominasz szkolne przerwy?;Przeszłość;NIE;TAK
fun057;Czy zdarza Ci się mówić do siebie i udawać, że ktoś odpowiada?;Śmieszne;NIE;TAK
imp072;Wolisz pić wino czerwone czy białe?;Imprezowe;CZERWONE;BIAŁE
dyl017;Wolisz mieć super pamięć do liczb czy do twarzy?;Dylematy;LICZBY;TWARZE
swi011;Czy uważasz, że wojny są czasem konieczne?;Światopoglądowe;NIE;TAK
zwi006;Ważniejsze dla Ciebie są czyny czy słowa?;Związkowe;CZYNY;SŁOWA
